source_id,target_id,target_title,discipline
https://openalex.org/W2983041606,https://openalex.org/W4238441343,Design Thinking,Engineering
https://openalex.org/W2983041606,https://openalex.org/W2029877285,Design method and scientific method,Computer science
https://openalex.org/W2983041606,https://openalex.org/W2104283072,The Relevance of Systematic Reviews to Educational Policy and Practice,Sociology
https://openalex.org/W2983041606,https://openalex.org/W2738590856,"""Normal science"" and the changing practices of design and design education",Sociology
https://openalex.org/W2983041606,https://openalex.org/W2090896973,The effectiveness of western creative teaching methods in China: An action research project.,Psychology
https://openalex.org/W2983041606,https://openalex.org/W2023989269,The core of ‘design thinking’ and its application,Engineering
https://openalex.org/W2983041606,https://openalex.org/W2139894798,Expansive Learning at Work: Toward an activity theoretical reconceptualization,Sociology
https://openalex.org/W2983041606,https://openalex.org/W2398997287,The democratisation of design and design learning: how do we educate the next-generation designer,Engineering
https://openalex.org/W2983041606,https://openalex.org/W845114548,Learning Design Thinking by Designing Learning Experiences: A Case Study in the Development of Strategic Thinking Skills through the Design of Interactive Museum Exhibitions,Computer science
https://openalex.org/W2983041606,https://openalex.org/W1984957114,Process and Pedagogy in Undergraduate Graphic Design Education,Computer science
https://openalex.org/W2983041606,https://openalex.org/W4256201318,Creativity.,Psychology
https://openalex.org/W2983041606,https://openalex.org/W1986642396,The structure of intellect.,Psychology
https://openalex.org/W2983041606,https://openalex.org/W2035784275,Funds of Knowledge: An investigation of coherence within the literature,Sociology
https://openalex.org/W2983041606,https://openalex.org/W2470547864,A theory of creative expressiveness: empirical studies in Chinese universities,Psychology
https://openalex.org/W2983041606,https://openalex.org/W2076510683,Describing the creative design process by the integration of engineering design and cognitive psychology literature,Computer science
https://openalex.org/W1975043685,https://openalex.org/W1531803554,The Theory and Practice of Group Psychotherapy:,Psychology
https://openalex.org/W1975043685,https://openalex.org/W2106470680,Educating the reflective practitioner,Psychology
https://openalex.org/W1975043685,https://openalex.org/W151379687,Teaching ward nurses to monitor cancer patients.,Medicine
https://openalex.org/W1975043685,https://openalex.org/W2149689412,Emotional and physical health benefits of expressive writing,Psychology
https://openalex.org/W1975043685,https://openalex.org/W1969736069,"Nursing, empathy and perception of the moral",Psychology
https://openalex.org/W1975043685,https://openalex.org/W2117599098,Nursing the patient with severe communication impairment,Medicine
https://openalex.org/W1975043685,https://openalex.org/W2015144111,Poetry as an aesthetic expression for nursing: a review,Medicine
https://openalex.org/W1975043685,https://openalex.org/W2018568834,The role of communications in nursing care for elderly people: a review of the literature,Psychology
https://openalex.org/W1975043685,https://openalex.org/W2148030010,Communications between staff and adults with intellectual disabilities in naturally occurring settings,Psychology
https://openalex.org/W1975043685,https://openalex.org/W2016672977,Reinforcing communication skills while registered nurses simultaneously learn course content: A response to learning needs,Psychology
https://openalex.org/W1975043685,https://openalex.org/W2044255683,Health professionals’ experience of paintings as a conversation instrument: a communication strategy at a nursing home in Sweden,Psychology
https://openalex.org/W1975043685,https://openalex.org/W2053876504,Assessment of clinical skills: a new approach to an old problem,Psychology
https://openalex.org/W1975043685,https://openalex.org/W2166393475,Student nurse–older person communication,Psychology
https://openalex.org/W1975043685,https://openalex.org/W2112703711,Factors influencing nurse–patient interaction in the acute psychiatric setting: An exploratory investigation,Medicine
https://openalex.org/W1975043685,https://openalex.org/W2171184576,Nurses' self-reflection via videotaping to improve communication skills in health counseling,Psychology
https://openalex.org/W1975043685,https://openalex.org/W2067579096,The impact of student learning styles on interviewing skills and academic performance,Psychology
https://openalex.org/W1975043685,https://openalex.org/W2019743681,Nursing student–patient relationship: Experiences of students and patients,Psychology
https://openalex.org/W1975043685,https://openalex.org/W1990132169,Complexity of staff communication and reported level of understanding skills in adults with intellectual disability,Psychology
https://openalex.org/W1975043685,https://openalex.org/W2113240784,Evaluation of communication training programs in nursing care: a review of the literature,Psychology
https://openalex.org/W1975043685,https://openalex.org/W2150733197,Achieving dignified care for older people through practice development: A systematic approach,Medicine
https://openalex.org/W3135863660,https://openalex.org/W4250589301,,Unknown
https://openalex.org/W3135863660,https://openalex.org/W3004566174,,Unknown
https://openalex.org/W3135863660,https://openalex.org/W2978445242,Impact of Hovering Inaccuracy on UAV-Aided RFET,Computer science
https://openalex.org/W3135863660,https://openalex.org/W2887592610,Optimal 3D-Trajectory Design and Resource Allocation for Solar-Powered UAV Communication Systems,Computer science
https://openalex.org/W3135863660,https://openalex.org/W2140242774,Survey of maneuvering targettracking . part I: dynamic models,Computer science
https://openalex.org/W3135863660,https://openalex.org/W2099272073,An Advanced Cooperative Path Prediction Algorithm for Safety Applications in Vehicular Networks,Computer science
https://openalex.org/W3135863660,https://openalex.org/W2904900506,A Generalization of Bayesian Inference,Mathematics
https://openalex.org/W3135863660,https://openalex.org/W4301347335,A Mathematical Theory of Evidence,Computer science
https://openalex.org/W3135863660,https://openalex.org/W2096007955,Development of a real-time DGPS system in the centimeter range,Computer science
https://openalex.org/W3135863660,https://openalex.org/W2872059434,Deployment Strategies of Multiple Aerial BSs for User Coverage and Power Efficiency Maximization,Computer science
https://openalex.org/W3135863660,https://openalex.org/W2995379809,Receding Horizon Optimization for Energy-Efficient UAV Communication,Computer science
https://openalex.org/W3135863660,https://openalex.org/W2963697941,Adaptive Deployment for UAV-Aided Communication Networks,Computer science
https://openalex.org/W3135863660,https://openalex.org/W2612291478,Ultra Reliable UAV Communication Using Altitude and Cooperation Diversity,Computer science
https://openalex.org/W3135863660,https://openalex.org/W2528788999,Caching in the Sky: Proactive Deployment of Cache-Enabled Unmanned Aerial Vehicles for Optimized Quality-of-Experience,Computer science
https://openalex.org/W3135863660,https://openalex.org/W2997841073,Rendezvous: Opportunistic Data Delivery to Mobile Users by UAVs Through Target Trajectory Prediction,Computer science
https://openalex.org/W3135863660,https://openalex.org/W2989005460,UAV-Aided Wireless Communication Designs With Propulsion Energy Limitations,Computer science
https://openalex.org/W3135863660,https://openalex.org/W2964023906,Energy Minimization for Wireless Communication With Rotary-Wing UAV,Computer science
https://openalex.org/W3135863660,https://openalex.org/W2952736579,Trajectory Design and Power Control for Multi-UAV Assisted Wireless Networks: A Machine Learning Approach,Computer science
https://openalex.org/W3135863660,https://openalex.org/W2296319761,Convex Optimization,Computer science
https://openalex.org/W3135863660,https://openalex.org/W1512921847,A Generalization of Bayesian Inference,Mathematics
https://openalex.org/W3046481661,https://openalex.org/W2733031627,A Novel Planar Slot Antenna Structure for 5G Mobile Networks Applications,Computer science
https://openalex.org/W3046481661,https://openalex.org/W2943817784,Investigation of Future 5G-IoT Millimeter-Wave Network Performance at 38 GHz for Urban Microcell Outdoor Environment,Computer science
https://openalex.org/W3046481661,https://openalex.org/W2624494617,Multibeam Antenna Technologies for 5G Wireless Communications,Computer science
https://openalex.org/W3046481661,https://openalex.org/W2963933750,Low RF-Complexity Technologies to Enable Millimeter-Wave MIMO with Large Antenna Array for 5G Wireless Communications,Computer science
https://openalex.org/W3046481661,https://openalex.org/W2758509129,A Multiband Millimeter-Wave 2-D Array Based on Enhanced Franklin Antenna for 5G Wireless Systems,Computer science
https://openalex.org/W3046481661,https://openalex.org/W2952874315,Compact low radar cross‐section microstrip patch antenna using particle swarm optimization,Physics
https://openalex.org/W3046481661,https://openalex.org/W2098890486,"5G and ""IMT for 2020 and beyond"" [Spectrum Policy and Regulatory Issues]",Computer science
https://openalex.org/W3046481661,https://openalex.org/W6752665980,,Unknown
https://openalex.org/W3046481661,https://openalex.org/W1039842480,The Effect of Changing Substrate Material and Thickness on the Performance of Inset Feed Microstrip Patch Antenna,Materials science
https://openalex.org/W3046481661,https://openalex.org/W3024359898,Effect of Dielectric Substrate Parameters Which Dimensions of Lens and Distance From Antenna on The Gain Enhancement of Microstrip Antenna with Metamaterial,Materials science
https://openalex.org/W3046481661,https://openalex.org/W2963276168,,Unknown
https://openalex.org/W3046481661,https://openalex.org/W2728341763,6–100 GHz research progress and challenges from a channel perspective for fifth generation (5G) and future wireless communication,Computer science
https://openalex.org/W3046481661,https://openalex.org/W2805657678,A Survey on Hybrid Beamforming Techniques in 5G: Architecture and System Model Perspectives,Computer science
https://openalex.org/W3046481661,https://openalex.org/W2626889522,Radio Resource Management Considerations for 5G Millimeter Wave Backhaul and Access Networks,Computer science
https://openalex.org/W3046481661,https://openalex.org/W2724724053,"Beamforming techniques for massive MIMO systems in 5G: overview, classification, and trends for future research",Computer science
https://openalex.org/W3046481661,https://openalex.org/W2858664339,Beamforming Techniques for Nonorthogonal Multiple Access in 5G Cellular Networks,Computer science
https://openalex.org/W3046481661,https://openalex.org/W2901220633,Channel Coding in 5G New Radio: A Tutorial Overview and Performance Comparison with 4G LTE,Computer science
https://openalex.org/W3046481661,https://openalex.org/W2748327393,Millimeter-Wave 5G Antennas for Smartphones: Overview and Experimental Demonstration,Computer science
https://openalex.org/W3046481661,https://openalex.org/W2920107005,Characterizations of Mutual Coupling Effects on Switch-Based Phased Array Antennas for 5G Millimeter-Wave Mobile Communications,Computer science
https://openalex.org/W3046481661,https://openalex.org/W2808617813,A comparative study on different types of metamaterials for enhancement of microstrip patch antenna directivity at the Ku-band (12 GHz),Materials science
https://openalex.org/W2058331630,https://openalex.org/W2144879192,Focus Group Interview: An Underutilized Research Technique for Improving Theory and Practice in Health Education,Psychology
https://openalex.org/W2058331630,https://openalex.org/W2033938877,Digital Storytelling as a Signature Pedagogy for the New Humanities,Sociology
https://openalex.org/W2058331630,https://openalex.org/W1999720399,“AIDS is rape!” gender and sexuality in children's responses to HIV and AIDS,Sociology
https://openalex.org/W2058331630,https://openalex.org/W1607286179,Therapeutic narrative illness writing and the quest for healing.,Psychology
https://openalex.org/W2058331630,https://openalex.org/W1988511601,"Hearing Ordinary Voices: Cultural Studies, Vernacular Creativity and Digital Storytelling",Art
https://openalex.org/W2058331630,https://openalex.org/W2028192475,Digital storytelling in Australia,Sociology
https://openalex.org/W2058331630,https://openalex.org/W2140429944,"Challenges Faced by People Living with HIV/AIDS in Cape Town, South Africa: Issues for Group Risk Reduction Interventions",Medicine
https://openalex.org/W2058331630,https://openalex.org/W6638065504,,Unknown
https://openalex.org/W2058331630,https://openalex.org/W2083904749,What works best: Objective statistics or a personal testimonial? An assessment of the persuasive effects of different types of message evidence on risk perception.,Psychology
https://openalex.org/W2058331630,https://openalex.org/W1501835616,Radical Media: Rebellious Communication and Social Movements,Political science
https://openalex.org/W2058331630,https://openalex.org/W2048359928,"“I’m positive, I have something to say”: Assessing the impact of a creative writing group for adolescents living with HIV",Psychology
https://openalex.org/W2058331630,https://openalex.org/W4233717222,The Wounded Storyteller,History
https://openalex.org/W2058331630,https://openalex.org/W1968916202,Media activism and Internet use by people with HIV/AIDS,Sociology
https://openalex.org/W2058331630,https://openalex.org/W4235809384,The role of transportation in the persuasiveness of public narratives.,Psychology
https://openalex.org/W2058331630,https://openalex.org/W2130741716,The Uses of Multimedia: Three Digital Literacy Case Studies,Computer science
https://openalex.org/W2058331630,https://openalex.org/W1967148743,Teens speak out about HIV/AIDS: Focus group discussions about risk and decision-making,Psychology
https://openalex.org/W2058331630,https://openalex.org/W2168356267,Our own voices: New paradigms for art therapy research,Psychology
https://openalex.org/W2058331630,https://openalex.org/W2159172402,The methodology of Focus Groups: the importance of interaction between research participants,Psychology
https://openalex.org/W2058331630,https://openalex.org/W7001388089,Introducing focus groups,Unknown
https://openalex.org/W2058331630,https://openalex.org/W1988007237,Making meaning in muddy waters: representing complexity through community based storytelling,Sociology
https://openalex.org/W4200067809,https://openalex.org/W4250907065,<i>Call for Special Issue Papers:</i> Big Data-Driven Futuristic Fabric System in Societal Digital Transformation,Computer science
https://openalex.org/W4200067809,https://openalex.org/W3047392324,How and when do big data investments pay off? The role of marketing affordances and service innovation,Business
https://openalex.org/W4200067809,https://openalex.org/W3045704391,DataV: Data Visualization on large high-resolution displays,Computer science
https://openalex.org/W4200067809,https://openalex.org/W3040509965,Supporting Data-Driven Business Model Innovations,Computer science
https://openalex.org/W4200067809,https://openalex.org/W3088445807,A data-driven approach for discovery of the latest research trends in higher education for business by leveraging advanced technology and big data,Political science
https://openalex.org/W4200067809,https://openalex.org/W3099026481,Walking through the forests of the future: using data-driven virtual reality to visualize forests under climate change,Computer science
https://openalex.org/W4200067809,https://openalex.org/W4239890301,"Deep Learning-assisted Smart Process Planning, Cognitive Automation, and Industrial Big Data Analytics in Sustainable Cyber-Physical Production Systems",Computer science
https://openalex.org/W4200067809,https://openalex.org/W3010161961,Review: Synergy between mechanistic modelling and data-driven models for modern animal production systems in the era of big data,Computer science
https://openalex.org/W4200067809,https://openalex.org/W3070228147,The Rise of Big Data in Communication Sciences: A Bibliometric Mapping of the Literature,Computer science
https://openalex.org/W4200067809,https://openalex.org/W3211346320,"Big Data-driven Innovation, Deep Learning-assisted Smart Process Planning, and Product Decision-Making Information Systems in Sustainable Industry 4.0",Business
https://openalex.org/W4200067809,https://openalex.org/W3014763785,A framework for data-driven design in a product innovation process: data analysis and visualisation for model-based decision making,Computer science
https://openalex.org/W4200067809,https://openalex.org/W3081456333,Data-Driven Aerospace Engineering: Reframing the Industry with Machine Learning,Computer science
https://openalex.org/W4200067809,https://openalex.org/W3186516617,"Artificial Intelligence Data-driven Internet of Things Systems, Real-Time Process Monitoring, and Sustainable Industrial Value Creation in Smart Networked Factories",Business
https://openalex.org/W4200067809,https://openalex.org/W3121834075,Big data and analytics: a data management perspective in public administration,Computer science
https://openalex.org/W4200067809,https://openalex.org/W3013466130,Data-driven planning support system for a campus design,Computer science
https://openalex.org/W4200067809,https://openalex.org/W3131841536,"Manufacturing as a Data-Driven Practice: Methodologies, Technologies, and Tools",Computer science
https://openalex.org/W4200067809,https://openalex.org/W3018063079,Mining Big Data in Education: Affordances and Challenges,Computer science
https://openalex.org/W4200067809,https://openalex.org/W3135706671,Smart Cities and Big Data Analytics: A Data-Driven Decision-Making Use Case,Computer science
https://openalex.org/W4200067809,https://openalex.org/W4247227000,Big Data in Auditing for the Future of Data Driven Fraud Detection,Business
https://openalex.org/W4200067809,https://openalex.org/W3042184416,A Data-Driven Approach for Generating Synthetic Load Patterns and Usage Habits,Computer science
https://openalex.org/W2607309088,https://openalex.org/W2081211779,Design principles for visual communication,Computer science
https://openalex.org/W2607309088,https://openalex.org/W2031794112,Towards a narrative theory of virtual reality,Computer science
https://openalex.org/W2607309088,https://openalex.org/W2080482164,Where the Bodies are Buried: Cartesian Dispositions in Narrative Theories of Character,Sociology
https://openalex.org/W2607309088,https://openalex.org/W6661592301,,Unknown
https://openalex.org/W2607309088,https://openalex.org/W2086337311,Life as Narrative,Computer science
https://openalex.org/W2607309088,https://openalex.org/W2101213471,Learning in the visual arts and the worldviews of young children,Psychology
https://openalex.org/W2607309088,https://openalex.org/W2021176669,"Rethinking Design Education for the 21st Century: Theoretical, Methodological, and Ethical Discussion",Sociology
https://openalex.org/W2607309088,https://openalex.org/W1578970219,Histories of Narrative Theory (II): From Structuralism to the Present,Sociology
https://openalex.org/W2607309088,https://openalex.org/W7058438769,Narrative discourse an essay in method,Sociology
https://openalex.org/W2607309088,https://openalex.org/W578761614,The Cambridge Companion to Narrative,Sociology
https://openalex.org/W2607309088,https://openalex.org/W6632270577,,Unknown
https://openalex.org/W2607309088,https://openalex.org/W2109823031,Narrative theory and emergent interactive narrative,Computer science
https://openalex.org/W2607309088,https://openalex.org/W2344323100,Narrative – State of the Art,Art
https://openalex.org/W2607309088,https://openalex.org/W4234002550,Narrative Domains,Art
https://openalex.org/W2607309088,https://openalex.org/W2315180439,<i>Narrative Knowing and the Human Sciences.</i>Donald E. Polkinghorne,Psychology
https://openalex.org/W2607309088,https://openalex.org/W6630854863,,Unknown
https://openalex.org/W2607309088,https://openalex.org/W2093185352,"Narrative Versions, Narrative Theories",History
https://openalex.org/W2607309088,https://openalex.org/W2603068212,Applying Narrative Theories in the Design of Public-cause Posters: Process and Educational Implications,Psychology
https://openalex.org/W2607309088,https://openalex.org/W150850289,Foundations for Design Education: Continuing the Bauhaus<i>Vorkurs</i>Vision,Art
https://openalex.org/W2607309088,https://openalex.org/W1543147108,Visual Communication: Images with Messages,Computer science
https://openalex.org/W3159850512,https://openalex.org/W2989743749,UAV-Enhanced Intelligent Offloading for Internet of Things at the Edge,Computer science
https://openalex.org/W3159850512,https://openalex.org/W2981726317,Joint Computation and Communication Design for UAV-Assisted Mobile Edge Computing in IoT,Computer science
https://openalex.org/W3159850512,https://openalex.org/W2981876784,Physical Layer Security in UAV Systems: Challenges and Opportunities,Computer science
https://openalex.org/W3159850512,https://openalex.org/W2912917423,Joint Trajectory and Communication Design for Secure UAV Networks,Computer science
https://openalex.org/W3159850512,https://openalex.org/W2981262799,Secure Communications for UAV-Enabled Mobile Edge Computing Systems,Computer science
https://openalex.org/W3159850512,https://openalex.org/W2963117265,Securing UAV Communications via Joint Trajectory and Power Control,Computer science
https://openalex.org/W3159850512,https://openalex.org/W2801399598,Exploiting Physical-Layer Security for Multiuser Multicarrier Computation Offloading,Computer science
https://openalex.org/W3159850512,https://openalex.org/W2982531427,Energy-Efficient Resource Allocation for Secure NOMA-Enabled Mobile Edge Computing Networks,Computer science
https://openalex.org/W3159850512,https://openalex.org/W2999672258,Response Delay Optimization in Mobile Edge Computing Enabled UAV Swarm,Computer science
https://openalex.org/W3159850512,https://openalex.org/W3034606981,"A Survey of Multi-Access Edge Computing in 5G and Beyond: Fundamentals, Technology Integration, and State-of-the-Art",Computer science
https://openalex.org/W3159850512,https://openalex.org/W2994008524,Accessing From the Sky: A Tutorial on UAV Communications for 5G and Beyond,Computer science
https://openalex.org/W3159850512,https://openalex.org/W2899183567,Joint Offloading and Trajectory Design for UAV-Enabled Mobile Edge Computing Systems,Computer science
https://openalex.org/W3159850512,https://openalex.org/W2514674767,Cyclical Multiple Access in UAV-Aided Communications: A Throughput-Delay Tradeoff,Computer science
https://openalex.org/W3159850512,https://openalex.org/W2984035125,Joint Trajectory-Resource Optimization in UAV-Enabled Edge-Cloud System With Virtualized Mobile Clone,Computer science
https://openalex.org/W3159850512,https://openalex.org/W2624989916,A Survey on Mobile Edge Computing: The Communication Perspective,Computer science
https://openalex.org/W3159850512,https://openalex.org/W2522123397,Mobile Edge Computing via a UAV-Mounted Cloudlet: Optimization of Bit Allocation and Path Planning,Computer science
https://openalex.org/W3159850512,https://openalex.org/W3103377783,,Unknown
https://openalex.org/W3118814157,https://openalex.org/W2781570898,A miniature implantable coil that can be wrapped around a tubular organ within the human body,Materials science
https://openalex.org/W3118814157,https://openalex.org/W2771244591,A double-helix and cross-patterned solenoid used as a wirelessly powered receiver for medical implants,Materials science
https://openalex.org/W3118814157,https://openalex.org/W3093921605,Optimizing Volumetric Efficiency and Backscatter Communication in Biosensing Ultrasonic Implants,Materials science
https://openalex.org/W3118814157,https://openalex.org/W2153394378,Millimeter-Wave Identification—A New Short-Range Radio System for Low-Power High Data-Rate Applications,Computer science
https://openalex.org/W3118814157,https://openalex.org/W2172018498,Optimal Operating Frequency in Wireless Power Transmission for Implantable Devices,Computer science
https://openalex.org/W3118814157,https://openalex.org/W2775597598,Simultaneous Wireless Information and Power Transfer (SWIPT): Recent Advances and Future Challenges,Computer science
https://openalex.org/W3118814157,https://openalex.org/W2586735669,An RF-Powered FDD Radio for Neural Microimplants,Computer science
https://openalex.org/W3118814157,https://openalex.org/W2905609095,"A 6.25 Mbps, 12.4 pJ/bit DQPSK Backscatter Wireless Uplink for the NeuroDisc Brain-Computer Interface",Computer science
https://openalex.org/W3118814157,https://openalex.org/W2917719559,Wideband UHF DQPSK Backscatter Communication in Reverberant Cavity Animal Cage Environments,Materials science
https://openalex.org/W3118814157,https://openalex.org/W2908053228,Radio Frequency Backscatter Communication for High Data Rate Deep Implants,Computer science
https://openalex.org/W3118814157,https://openalex.org/W2621070844,Simultaneous wireless power transfer and data communication using synchronous pulse-controlled load modulation,Computer science
https://openalex.org/W3118814157,https://openalex.org/W2899415736,Magnetically Balanced Power and Data Telemetry for mm-scale Neural Implants,Computer science
