source_id,target_id,target_title,discipline
https://openalex.org/W2963304955,https://openalex.org/W2963542767,Common Throughput Maximization in UAV-Enabled OFDMA Systems With Delay Consideration,Computer science
https://openalex.org/W2963304955,https://openalex.org/W3098405735,Unmanned aerial vehicle with underlaid device-to-device communications:performance and tradeoffs,Computer science
https://openalex.org/W2997491196,https://openalex.org/W2963542767,Common Throughput Maximization in UAV-Enabled OFDMA Systems With Delay Consideration,Computer science
https://openalex.org/W2997491196,https://openalex.org/W2944234465,Completion Time Minimization With Path Planning for Fixed-Wing UAV Communications,Computer science
https://openalex.org/W2997491196,https://openalex.org/W2963061782,Joint Trajectory and Communication Design for Multi-UAV Enabled Wireless Networks,Computer science
https://openalex.org/W2997491196,https://openalex.org/W2922102150,Anti-Jamming Path Planning for Unmanned Aerial Vehicles with Imperfect Jammer Information,Computer science
https://openalex.org/W2997491196,https://openalex.org/W4250589301,,Unknown
https://openalex.org/W2997491196,https://openalex.org/W1997834106,Fundamentals of Wireless Communication,Computer science
https://openalex.org/W2997491196,https://openalex.org/W2893917677,Throughput Maximization in Multi-UAV Enabled Communication Systems With Difference Consideration,Computer science
https://openalex.org/W2997491196,https://openalex.org/W2918864322,Physical Layer Security in Cognitive Radio Inspired NOMA Network,Computer science
https://openalex.org/W2997491196,https://openalex.org/W2991427780,Secure Transmission in HARQ-Assisted Non-Orthogonal Multiple Access Networks,Computer science
https://openalex.org/W2997491196,https://openalex.org/W2914135950,Secure Transmission in Non-Orthogonal Multiple Access Networks With an Untrusted Relay,Computer science
https://openalex.org/W2997491196,https://openalex.org/W2516435836,On the Secure Spectral-Energy Efficiency Tradeoff in Random Cognitive Radio Networks,Computer science
https://openalex.org/W2997491196,https://openalex.org/W2619775665,Secure Hybrid VLC-RF Systems with Light Energy Harvesting,Computer science
https://openalex.org/W2997491196,https://openalex.org/W2562378549,On Secure VLC Systems With Spatially Random Terminals,Computer science
https://openalex.org/W2997491196,https://openalex.org/W2963117265,Securing UAV Communications via Joint Trajectory and Power Control,Computer science
https://openalex.org/W2997491196,https://openalex.org/W2885551694,Dual-UAV-Enabled Secure Communications: Joint Trajectory Design and User Scheduling,Computer science
https://openalex.org/W2997491196,https://openalex.org/W2914952404,UAV-Relaying-Assisted Secure Transmission With Caching,Computer science
https://openalex.org/W2997491196,https://openalex.org/W2809622385,Energy-efficient trajectory planning for UAV-aided secure communication,Computer science
https://openalex.org/W2997491196,https://openalex.org/W2928340778,UAV Relay Flight Path Planning in the Presence of Jamming Signal,Computer science
https://openalex.org/W2997491196,https://openalex.org/W2963435939,Unmanned Aerial Vehicle-Aided Communications: Joint Transmit Power and Trajectory Optimization,Computer science
https://openalex.org/W2997491196,https://openalex.org/W2902769219,Trajectory Planning in UAV Communication with Jamming,Computer science
https://openalex.org/W2144337810,https://openalex.org/W2014806649,Communication as Design,Psychology
https://openalex.org/W2144337810,https://openalex.org/W2320197269,CRAFTING INTERACTIVITY FOR STAKEHOLDER ENGAGEMENT: TRANSFORMING ASSUMPTIONS ABOUT COMMUNICATION IN SCIENCE AND POLICY,Psychology
https://openalex.org/W2144337810,https://openalex.org/W2133384120,Revisiting the Role of “Shared Value” in the Business-Society Relationship,Business
https://openalex.org/W2144337810,https://openalex.org/W1989705417,"Activity, materiality, and creative struggle in the communicative constitution of organizing",Sociology
https://openalex.org/W2144337810,https://openalex.org/W2069772692,Designing Communication for the Day-to-Day Safety Oversight of Nuclear Power Plants,Psychology
https://openalex.org/W2144337810,https://openalex.org/W986295664,Leveraging Corporate Responsibility,Business
https://openalex.org/W2144337810,https://openalex.org/W6653126216,,Unknown
https://openalex.org/W2144337810,https://openalex.org/W2135999376,Assessing the impact of stakeholder dialogue: changing relationships between NGOs and companies,Business
https://openalex.org/W2144337810,https://openalex.org/W2154869167,The Johnson &amp; Johnson bridge to employment initiative: building sustainable community education partnerships,Sociology
https://openalex.org/W2144337810,https://openalex.org/W2076101538,Building Partnerships to Create Social and Economic Value at the Base of the Global Development Pyramid,Sociology
https://openalex.org/W2144337810,https://openalex.org/W2135322495,Open Innovation and Strategy,Business
https://openalex.org/W2144337810,https://openalex.org/W2104427906,Communication Theory as a Field,Sociology
https://openalex.org/W2144337810,https://openalex.org/W2024179187,Grounded Practical Theory: The Case of Intellectual Discussion,Sociology
https://openalex.org/W2144337810,https://openalex.org/W1971300686,Building Grounded Practical Theory in Applied Communication Research: Introduction to the Special Issue,Sociology
https://openalex.org/W2144337810,https://openalex.org/W2095568617,Contesting the Value of “Creating Shared Value”,Sociology
https://openalex.org/W2144337810,https://openalex.org/W2048224309,Engaging stakeholders in corporate accountability programmes: A cross‐sectoral analysis of UK and transnational experience,Political science
https://openalex.org/W2144337810,https://openalex.org/W2122845988,Corporate-NGO Collaboration: Co-creating New Business Models for Developing Markets,Business
https://openalex.org/W2144337810,https://openalex.org/W1994549698,Promoting eco manufacturing: an Australian case,Business
https://openalex.org/W2144337810,https://openalex.org/W2089087592,"The Stakeholder Theory of the Corporation: Concepts, Evidence, and Implications",Sociology
https://openalex.org/W2144337810,https://openalex.org/W3123429165,,Unknown
https://openalex.org/W2989173596,https://openalex.org/W6749524206,,Unknown
https://openalex.org/W2989173596,https://openalex.org/W6756244211,,Unknown
https://openalex.org/W2989173596,https://openalex.org/W6756739692,,Unknown
https://openalex.org/W2989173596,https://openalex.org/W6762224649,,Unknown
https://openalex.org/W2989173596,https://openalex.org/W6755599991,,Unknown
https://openalex.org/W2989173596,https://openalex.org/W2895882341,A Collision-Free Surveillance System Using Smart UAVs in Multi Domain IoT,Computer science
https://openalex.org/W2989173596,https://openalex.org/W2268751503,Wireless communications with unmanned aerial vehicles: opportunities and challenges,Computer science
https://openalex.org/W2989173596,https://openalex.org/W2962804513,Energy-Efficient UAV Communication With Trajectory Optimization,Computer science
https://openalex.org/W2989173596,https://openalex.org/W2738731084,The Sky Is Not the Limit: LTE for Unmanned Aerial Vehicles,Computer science
https://openalex.org/W2989173596,https://openalex.org/W6719947625,,Unknown
https://openalex.org/W2989173596,https://openalex.org/W2586992378,UAV-Based IoT Platform: A Crowd Surveillance Use Case,Computer science
https://openalex.org/W2989173596,https://openalex.org/W2898157791,Transceiver Design and Multihop D2D for UAV IoT Coverage in Disasters,Computer science
https://openalex.org/W2989173596,https://openalex.org/W2904635850,Ultra-Reliable IoT Communications with UAVs: A Swarm Use Case,Computer science
https://openalex.org/W2989173596,https://openalex.org/W6758090675,,Unknown
https://openalex.org/W2989173596,https://openalex.org/W2963562791,Joint Altitude and Beamwidth Optimization for UAV-Enabled Multiuser Communications,Computer science
https://openalex.org/W2989173596,https://openalex.org/W6724372461,,Unknown
https://openalex.org/W2989173596,https://openalex.org/W2790256744,UAV Trajectory Optimization for Data Offloading at the Edge of Multiple Cells,Computer science
https://openalex.org/W2989173596,https://openalex.org/W2523219060,Throughput Maximization for UAV-Enabled Mobile Relaying Systems,Computer science
https://openalex.org/W2989173596,https://openalex.org/W2917190936,Maximization of Data Dissemination in UAV-Supported Internet of Things,Computer science
https://openalex.org/W2989173596,https://openalex.org/W2963542767,Common Throughput Maximization in UAV-Enabled OFDMA Systems With Delay Consideration,Computer science
https://openalex.org/W2613605741,https://openalex.org/W2558431499,Placement Optimization of UAV-Mounted Mobile Base Stations,Computer science
https://openalex.org/W2613605741,https://openalex.org/W2514674767,Cyclical Multiple Access in UAV-Aided Communications: A Throughput-Delay Tradeoff,Computer science
https://openalex.org/W2613605741,https://openalex.org/W2523219060,Throughput Maximization for UAV-Enabled Mobile Relaying Systems,Computer science
https://openalex.org/W2613605741,https://openalex.org/W2113274749,Wireless Relay Communications with Unmanned Aerial Vehicles: Performance and Optimization,Computer science
https://openalex.org/W2613605741,https://openalex.org/W2798766386,Nonlinear Programming,Computer science
https://openalex.org/W2613605741,https://openalex.org/W2343823234,"Fundamental Green Tradeoffs: Progresses, Challenges, and Impacts on 5G Networks",Computer science
https://openalex.org/W2613605741,https://openalex.org/W2210084516,A Unified Algorithmic Framework for Block-Structured Optimization Involving Big Data: With applications in machine learning and signal processing,Computer science
https://openalex.org/W2613605741,https://openalex.org/W2963285294,Joint Trajectory and Communication Design for UAV-Enabled Multiple Access,Computer science
https://openalex.org/W2613605741,https://openalex.org/W2296319761,Convex Optimization,Computer science
https://openalex.org/W2613605741,https://openalex.org/W2412503523,Efficient Deployment of Multiple Unmanned Aerial Vehicles for Optimal Wireless Coverage,Computer science
https://openalex.org/W2613605741,https://openalex.org/W2763945873,Securing UAV Communications Via Trajectory Optimization,Computer science
https://openalex.org/W2613605741,https://openalex.org/W2964129085,An Overview of Sustainable Green 5G Networks,Computer science
https://openalex.org/W2613605741,https://openalex.org/W2268751503,Wireless communications with unmanned aerial vehicles: opportunities and challenges,Computer science
https://openalex.org/W2613605741,https://openalex.org/W2594517509,"Joint Optimization of User Association, Subchannel Allocation, and Power Allocation in Multi-Cell Multi-Association OFDMA Heterogeneous Networks",Computer science
https://openalex.org/W2613605741,https://openalex.org/W3098405735,Unmanned aerial vehicle with underlaid device-to-device communications:performance and tradeoffs,Computer science
https://openalex.org/W2613605741,https://openalex.org/W901642097,The Internet of Flying-Things: Opportunities and Challenges with Airborne Fog Computing and Mobile Cloud in the Clouds,Computer science
https://openalex.org/W2613605741,https://openalex.org/W2289204537,Efficient 3-D placement of an aerial base station in next generation cellular networks,Computer science
https://openalex.org/W2613605741,https://openalex.org/W2031834036,Optimal LAP Altitude for Maximum Coverage,Computer science
https://openalex.org/W2613605741,https://openalex.org/W2950347471,Mobile Edge Computing via a UAV-Mounted Cloudlet: Optimization of Bit Allocation and Path Planning,Computer science
https://openalex.org/W2613605741,https://openalex.org/W2791581070,Delay-constrained throughput maximization in UAV-enabled OFDM systems,Computer science
https://openalex.org/W2266385688,https://openalex.org/W1998047469,Directed Self-Assembly of Nanoparticles,Materials science
https://openalex.org/W2266385688,https://openalex.org/W1984558580,Surface roughness directed self-assembly of patchy particles into colloidal micelles,Materials science
https://openalex.org/W2266385688,https://openalex.org/W2054905409,Designed to yield,Materials science
https://openalex.org/W2266385688,https://openalex.org/W2162007763,Three‐dimensional Directed Assembly of Block Copolymers together with Two‐dimensional Square and Rectangular Nanolithography,Materials science
https://openalex.org/W2266385688,https://openalex.org/W2127293817,Inverse optimization techniques for targeted self-assembly,Computer science
https://openalex.org/W2266385688,https://openalex.org/W2120051327,Optimized Interactions for Targeted Self-Assembly: Application to a Honeycomb Lattice,Materials science
https://openalex.org/W2266385688,https://openalex.org/W2172142537,Synthetic diamond and wurtzite structures self-assemble with isotropic pair interactions,Materials science
https://openalex.org/W2266385688,https://openalex.org/W2112873175,Optimized monotonic convex pair potentials stabilize low-coordinated crystals,Mathematics
https://openalex.org/W2266385688,https://openalex.org/W1987804797,Unusual ground states via monotonic convex pair potentials,Mathematics
https://openalex.org/W2266385688,https://openalex.org/W2113447264,Phase Diagram of Star Polymer Solutions,Materials science
https://openalex.org/W2266385688,https://openalex.org/W2101441087,The zero-temperature phase diagram of soft-repulsive particle fluids,Physics
https://openalex.org/W3021971398,https://openalex.org/W2794618214,Low-delay broadband satellite communications with high-altitude unmanned aerial vehicles,Computer science
https://openalex.org/W3021971398,https://openalex.org/W2896835129,Energy-efficient multi-UAV coverage deployment in UAV networks: A game-theoretic framework,Computer science
https://openalex.org/W3021971398,https://openalex.org/W2729697725,Resource Allocations for Secure Cognitive Satellite-Terrestrial Networks,Computer science
https://openalex.org/W3021971398,https://openalex.org/W2884572749,Energy Efficient Cognitive Spectrum Sharing Scheme Based on Inter-Cell Fairness for Integrated Satellite-Terrestrial Communication Systems,Computer science
https://openalex.org/W3021971398,https://openalex.org/W2963218636,MmWave Vehicle-to-Infrastructure Communication: Analysis of Urban Microcellular Networks,Computer science
https://openalex.org/W3021971398,https://openalex.org/W2799944166,Graph-Based Resource Sharing in Vehicular Communication,Computer science
https://openalex.org/W3021971398,https://openalex.org/W2911165953,Joint CoMP Transmission for UAV-Aided Cognitive Satellite Terrestrial Networks,Computer science
https://openalex.org/W3021971398,https://openalex.org/W2810911398,Cooperative Communication for Cognitive Satellite Networks,Computer science
https://openalex.org/W3021971398,https://openalex.org/W2918542774,Joint User Access and Resource Association in Multicast Terrestrial-Satellite Cooperation Network,Computer science
https://openalex.org/W3021971398,https://openalex.org/W2797097527,Robust Secure Beamforming for 5G Cellular Networks Coexisting With Satellite Networks,Computer science
https://openalex.org/W3021971398,https://openalex.org/W2755200181,FCSS: Fog-Computing-based Content-Aware Filtering for Security Services in Information-Centric Social Networks,Computer science
https://openalex.org/W3021971398,https://openalex.org/W2898579014,Joint service improvement and content placement for cache‐enabled heterogeneous cellular networks,Computer science
https://openalex.org/W3021971398,https://openalex.org/W2964273565,Fog-Computing-Enabled Cognitive Network Function Virtualization for an Information-Centric Future Internet,Computer science
https://openalex.org/W3021971398,https://openalex.org/W2293583529,A Hierarchical Security Framework for Defending Against Sophisticated Attacks on Wireless Sensor Networks in Smart Cities,Computer science
https://openalex.org/W3021971398,https://openalex.org/W2793130752,Big Data Analysis-Based Secure Cluster Management for Optimized Control Plane in Software-Defined Networks,Computer science
https://openalex.org/W3021971398,https://openalex.org/W2585334930,Capacity of Cooperative Vehicular Networks With Infrastructure Support: Multiuser Case,Computer science
https://openalex.org/W3021971398,https://openalex.org/W2914337503,NSAC: A Novel Clustering Protocol in Cognitive Radio Sensor Networks for Internet of Things,Computer science
https://openalex.org/W3021971398,https://openalex.org/W3012434840,Edge QoE: Computation Offloading With Deep Reinforcement Learning for Internet of Things,Computer science
https://openalex.org/W3021971398,https://openalex.org/W2162742838,Comparative Investigation on CSMA/CA-Based Opportunistic Random Access for Internet of Things,Computer science
https://openalex.org/W3021971398,https://openalex.org/W2913304731,Resource Allocation for Low-Latency Vehicular Communications: An Effective Capacity Perspective,Computer science
https://openalex.org/W4391164045,https://openalex.org/W2974084046,"6G Visions: Mobile ultra-broadband, super internet-of-things, and artificial intelligence",Computer science
https://openalex.org/W4391164045,https://openalex.org/W3188554269,6G Internet of Things: A Comprehensive Survey,Computer science
https://openalex.org/W4391164045,https://openalex.org/W3037051439,UAV-Supported Clustered NOMA for 6G-Enabled Internet of Things: Trajectory Planning and Resource Allocation,Computer science
https://openalex.org/W4391164045,https://openalex.org/W4242781462,Ambient backscatter,Computer science
https://openalex.org/W4391164045,https://openalex.org/W2962732150,Cooperative Ambient Backscatter Communications for Green Internet-of-Things,Computer science
https://openalex.org/W4391164045,https://openalex.org/W2963205726,Optimal Resource Allocation in Full-Duplex Ambient Backscatter Communication Networks for Wireless-Powered IoT,Computer science
https://openalex.org/W4391164045,https://openalex.org/W3146291710,Symbiotic Communications: Where Marconi Meets Darwin,Computer science
https://openalex.org/W4391164045,https://openalex.org/W3129486236,Intelligent Reflecting Surface-Aided Wireless Communications: A Tutorial,Computer science
https://openalex.org/W4391164045,https://openalex.org/W3139899023,Reconfigurable Intelligent Surface Assisted MIMO Symbiotic Radio Networks,Computer science
https://openalex.org/W4391164045,https://openalex.org/W3130292564,Cooperative Beamforming for Large Intelligent Surface Assisted Symbiotic Radios,Computer science
https://openalex.org/W4391164045,https://openalex.org/W3153708218,A Novel Wireless Communication Paradigm for Intelligent Reflecting Surface Based Symbiotic Radio Systems,Computer science
https://openalex.org/W4391164045,https://openalex.org/W3198461541,On the Capacity of Reconfigurable Intelligent Surface Assisted MIMO Symbiotic Communications,Computer science
https://openalex.org/W4391164045,https://openalex.org/W3187736478,Intelligent Reflecting Surface Enhanced Multi-User MISO Symbiotic Radio Systems,Computer science
https://openalex.org/W4391164045,https://openalex.org/W4210487586,Reconfigurable Intelligent Surface Based Uplink Massive MIMO Symbiotic Radio System,Computer science
https://openalex.org/W4391164045,https://openalex.org/W3196686502,Intelligent Reflecting Surface-Aided Secure Broadcasting in Millimeter Wave Symbiotic Radio Networks,Computer science
https://openalex.org/W4391164045,https://openalex.org/W4225742878,"6G NR-U Based Wireless Infrastructure UAV: Standardization, Opportunities, Challenges and Future Scopes",Computer science
https://openalex.org/W4391164045,https://openalex.org/W4210525043,UAV-Assisted RIS for Future Wireless Communications: A Survey on Optimization and Performance Analysis,Computer science
https://openalex.org/W4391164045,https://openalex.org/W2963061782,Joint Trajectory and Communication Design for Multi-UAV Enabled Wireless Networks,Computer science
https://openalex.org/W4391164045,https://openalex.org/W3112368673,Joint 3D Trajectory and Power Optimization for UAV-Aided mmWave MIMO-NOMA Networks,Computer science
https://openalex.org/W4391164045,https://openalex.org/W2887592610,Optimal 3D-Trajectory Design and Resource Allocation for Solar-Powered UAV Communication Systems,Computer science
https://openalex.org/W4367052130,https://openalex.org/W2990740199,"RETRACTED ARTICLE: Application on Virtual Reality for Enhanced Education Learning, Military Training and Sports",Computer science
https://openalex.org/W4367052130,https://openalex.org/W2798243513,On the effectiveness of virtual reality in the education of software engineering,Computer science
https://openalex.org/W4367052130,https://openalex.org/W2913304133,What Is the Difference Between a Systematic Review and a Meta-analysis?,Computer science
https://openalex.org/W4367052130,https://openalex.org/W2909380077,A review of virtual reality technologies in the field of communication disability: implications for practice and research,Computer science
https://openalex.org/W4367052130,https://openalex.org/W2111335329,Beyond PICO,Computer science
https://openalex.org/W4367052130,https://openalex.org/W3091784321,Immersive virtual reality in K‐12 and higher education: A 10‐year systematic review of empirical research,Psychology
https://openalex.org/W4367052130,https://openalex.org/W3201171712,Application Analysis of Virtual Reality VR Technology in Art Design Teaching,Computer science
https://openalex.org/W4367052130,https://openalex.org/W2606853450,"Design, and design education: How can they get together?",Computer science
https://openalex.org/W4367052130,https://openalex.org/W3082306107,Implications of Virtual Reality in Arts Education: Research Analysis in the Context of Higher Education,Political science
https://openalex.org/W4367052130,https://openalex.org/W4205651383,Virtual Reality Technology in Visual Design of Artistic Images: Analysis and Applications,Computer science
https://openalex.org/W4367052130,https://openalex.org/W2922196645,Research on 3D Painting in Virtual Reality to Improve Students’ Motivation of 3D Animation Learning,Computer science
https://openalex.org/W4367052130,https://openalex.org/W4283375988,Research on Art Teaching Practice Supported by Virtual Reality (VR) Technology in the Primary Schools,Computer science
https://openalex.org/W4367052130,https://openalex.org/W3092037719,"The Effect of Geography Teaching Curriculum Enriched with Virtual Reality Applications on Teacher Candidates’ Interest for the Course, Achievement and the Tendencies to Utilise Information Technologies",Psychology
https://openalex.org/W4367052130,https://openalex.org/W2239471389,The Benefits of Virtual Reality in Education- A comparision Study,Computer science
https://openalex.org/W4367052130,https://openalex.org/W2980953136,Virtual Reality and Its Applications in Education: Survey,Computer science
https://openalex.org/W4367052130,https://openalex.org/W6746758037,,Unknown
https://openalex.org/W4367052130,https://openalex.org/W2955063220,Research of Digital Media Art based on Virtual Reality on Animation Design,Computer science
https://openalex.org/W4367052130,https://openalex.org/W3084795046,Effects of an immersive virtual reality‐based classroom on students’ learning performance in science lessons,Psychology
https://openalex.org/W4367052130,https://openalex.org/W3119269875,Interactive Study of Multimedia and Virtual Technology in Art Education,Computer science
https://openalex.org/W4367052130,https://openalex.org/W2759264816,A Virtual Reality Teaching System for Graphic Design Course,Computer science
https://openalex.org/W2094942327,https://openalex.org/W2014806649,Communication as Design,Psychology
https://openalex.org/W2094942327,https://openalex.org/W4237244665,The Role of Women in the Donation Consent Decision: Building on Previous Research,Psychology
https://openalex.org/W2094942327,https://openalex.org/W2095510066,"MEDIA PRIMING EFFECTS: ACCESSIBILITY, ASSOCIATION, AND ACTIVATION",Psychology
https://openalex.org/W2094942327,https://openalex.org/W1992302166,A Meta-Analytic Review of Communication Campaigns to Promote Organ Donation,Psychology
https://openalex.org/W2094942327,https://openalex.org/W2127638919,Using Theory to Design Effective Health Behavior Interventions,Psychology
https://openalex.org/W2094942327,https://openalex.org/W2012524512,"Effects of Information, Education, and Communication Training about Organ Donation for Gatekeepers: Clerks at the Department of Motor Vehicles and Organ Donor Registries",Medicine
https://openalex.org/W2094942327,https://openalex.org/W2060575063,Ombuds processes and disputant reconciliation,Political science
https://openalex.org/W2094942327,https://openalex.org/W1864274370,Disputation by Design,Political science
https://openalex.org/W2094942327,https://openalex.org/W2147837205,"The Media and Interpersonal Communications: The Priming of Issues, Leaders, and Party Identification",Political science
https://openalex.org/W2094942327,https://openalex.org/W2077841078,The Effectiveness of High- and Low-Intensity Worksite Campaigns to Promote Organ Donation: The Workplace Partnership for Life,Psychology
https://openalex.org/W2094942327,https://openalex.org/W1984119561,"Communicating about gifts of life: the effect of knowledge, attitudes, and altruism on behavior and behavioral intentions regarding organ donation",Psychology
https://openalex.org/W2094942327,https://openalex.org/W2157171998,"Signing cards, saving lives: an evaluation of the worksite organ donation promotion project",Psychology
