source_id,target_id,target_title,discipline
https://openalex.org/W3209423374,https://openalex.org/W3183544398,Freehand drawing versus digital design tools in architectural teaching,Computer science
https://openalex.org/W4280623691,https://openalex.org/W2159951683,The SpiNNaker Project,Computer science
https://openalex.org/W4280623691,https://openalex.org/W1673584506,Communication in Neuronal Networks,Computer science
https://openalex.org/W4280623691,https://openalex.org/W2994884340,Exploring Complex Brain-Simulation Workloads on Multi-GPU Deployments,Computer science
https://openalex.org/W4280623691,https://openalex.org/W3127379532,Larger GPU-accelerated brain simulations with procedural connectivity,Computer science
https://openalex.org/W4280623691,https://openalex.org/W2138913040,A million spiking-neuron integrated circuit with a scalable communication network and interface,Computer science
https://openalex.org/W4280623691,https://openalex.org/W2990793844,Towards spike-based machine intelligence with neuromorphic computing,Computer science
https://openalex.org/W4280623691,https://openalex.org/W2900081818,Multinode implementation of an extended Hodgkin–Huxley simulator,Computer science
https://openalex.org/W4280623691,https://openalex.org/W2018027127,Brian: a simulator for spiking neural networks in Python,Computer science
https://openalex.org/W4280623691,https://openalex.org/W2159927097,Brian 2 - the second coming: spiking neural network simulation in Python with code generation,Computer science
https://openalex.org/W4280623691,https://openalex.org/W2971430069,,Unknown
https://openalex.org/W4280623691,https://openalex.org/W1992962224,HRLSim: A High Performance Spiking Neural Network Simulator for GPGPU Clusters,Computer science
https://openalex.org/W4280623691,https://openalex.org/W2025835468,A novel CPU/GPU simulation environment for large-scale biologically realistic neural modeling,Computer science
https://openalex.org/W4280623691,https://openalex.org/W3125649389,Human-scale Brain Simulation via Supercomputer: A Case Study on the Cerebellum,Computer science
https://openalex.org/W4280623691,https://openalex.org/W3128537420,A Parameterized Approximation Scheme for Min $k$-Cut,Mathematics
https://openalex.org/W4280623691,https://openalex.org/W3133201538,Improving All-to-Many Personalized Communication in Two-Phase I/O,Computer science
https://openalex.org/W3160523492,https://openalex.org/W2922252406,High‐Entropy Oxides: Fundamental Aspects and Electrochemical Properties,Materials science
https://openalex.org/W3160523492,https://openalex.org/W2261135145,Entropy-stabilized oxides,Materials science
https://openalex.org/W3160523492,https://openalex.org/W3092189307,Cation-disordered rocksalt-type high-entropy cathodes for Li-ion batteries,Materials science
https://openalex.org/W3160523492,https://openalex.org/W2888579709,High entropy oxides for reversible energy storage,Materials science
https://openalex.org/W3160523492,https://openalex.org/W2522338520,Nanocrystalline multicomponent entropy stabilised transition metal oxides,Materials science
https://openalex.org/W3160523492,https://openalex.org/W2912070393,High entropy oxides as anode material for Li-ion battery applications: A practical approach,Materials science
https://openalex.org/W3160523492,https://openalex.org/W2942687817,Multi-anionic and -cationic compounds: new high entropy materials for advanced Li-ion batteries,Materials science
https://openalex.org/W3160523492,https://openalex.org/W3096847950,Lithium containing layered high entropy oxide structures,Materials science
https://openalex.org/W3160523492,https://openalex.org/W1992985800,Commentary: The Materials Project: A materials genome approach to accelerating materials innovation,Computer science
https://openalex.org/W3160523492,https://openalex.org/W3006620595,Electrochemical behavior of LiNi0.6Mn0.2Co0.2O2 cathode in different aqueous electrolytes,Materials science
https://openalex.org/W3160523492,https://openalex.org/W2162374645,Combining Ab Initio Computation with Experiments for Designing New Electrode Materials for Advanced Lithium Batteries: LiNi[sub 1/3]Fe[sub 1/6]Co[sub 1/6]Mn[sub 1/3]O[sub 2],Materials science
https://openalex.org/W3160523492,https://openalex.org/W1486503855,Various aspects of LiNiO<sub>2</sub>chemistry: A review,Materials science
https://openalex.org/W3160523492,https://openalex.org/W3017042963,Understanding the Overlithiation Properties of LiNi<sub>0.6</sub>Mn<sub>0.2</sub>Co<sub>0.2</sub>O<sub>2</sub> Using Electrochemistry and Depth-Resolved X-ray Absorption Spectroscopy,Materials science
https://openalex.org/W3160523492,https://openalex.org/W2411307251,Prelithiation Activates Li(Ni<sub>0.5</sub>Mn<sub>0.3</sub>Co<sub>0.2</sub>)O<sub>2</sub> for High Capacity and Excellent Cycling Stability,Materials science
https://openalex.org/W3160523492,https://openalex.org/W2399136101,Pre-Lithiation of Li(Ni<sub>1-<i>x</i>-<i>y</i></sub>Mn<sub><i>x</i></sub>Co<sub><i>y</i></sub>)O<sub>2</sub> Materials Enabling Enhancement of Performance for Li-Ion Battery,Materials science
https://openalex.org/W2014826025,https://openalex.org/W6632299113,,Unknown
https://openalex.org/W2014826025,https://openalex.org/W4237543216,Information Technology for Manufacturing,Business
https://openalex.org/W2014826025,https://openalex.org/W2033141245,The Medium and the Message: The Adaptive Use of Communication Media in Dyadic Influence,Psychology
https://openalex.org/W2014826025,https://openalex.org/W2164626036,Formalization of a process activity performance estimation approach using human competencies,Computer science
https://openalex.org/W2014826025,https://openalex.org/W2139910390,Virtual reality and augmented reality as a training tool for assembly tasks,Computer science
https://openalex.org/W2014826025,https://openalex.org/W1685479522,New approaches to instruction: because wisdom can't be told,Philosophy
https://openalex.org/W2014826025,https://openalex.org/W154990321,Computer-Mediated Communication: Cognitive Science Approach,Computer science
https://openalex.org/W2014826025,https://openalex.org/W2087578312,E-Mail Recipients' Impressions of Senders' Likability: The Interactive Effect of Nonverbal Cues and Recipients' Personality,Psychology
https://openalex.org/W2014826025,https://openalex.org/W1857210489,Advancing Information Systems Evaluation (Research): A Critical Realist Approach,Computer science
https://openalex.org/W2014826025,https://openalex.org/W1591574350,Impact of Communication Medium and Computer Support on Group Perceptions and Performance: A Comparison of Face-to-Face and Dispersed Meetings*,Computer science
https://openalex.org/W2014826025,https://openalex.org/W2059254035,Feedback After Good Trials Enhances Learning,Psychology
https://openalex.org/W2014826025,https://openalex.org/W4231152088,Working knowledge,Computer science
https://openalex.org/W2014826025,https://openalex.org/W2003939026,Information technology and economic performance,Computer science
https://openalex.org/W2014826025,https://openalex.org/W2114772011,"Media, Tasks, and Communication Processes: A Theory of Media Synchronicity1",Computer science
https://openalex.org/W2014826025,https://openalex.org/W2128101226,Beyond media richness: an empirical test of media synchronicity theory,Computer science
https://openalex.org/W2014826025,https://openalex.org/W2063612306,A Comparison of Verbal Instruction and Nonverbal Teacher-Student Modeling in Instrumental Ensembles,Psychology
https://openalex.org/W2014826025,https://openalex.org/W2084182646,Lexical ambiguity and fixation times in reading,Psychology
https://openalex.org/W2014826025,https://openalex.org/W4246133817,Use of verb information in syntactic parsing: Evidence from eye movements and word-by-word self-paced reading.,Computer science
https://openalex.org/W2014826025,https://openalex.org/W1600897307,Team‐based cellular manufacturing,Business
https://openalex.org/W2014826025,https://openalex.org/W4240524941,Phonological ambiguity and lexical ambiguity: Effects on visual and auditory word recognition.,Psychology
https://openalex.org/W1819863052,https://openalex.org/W2129963397,The usability engineering life cycle,Computer science
https://openalex.org/W2113165395,https://openalex.org/W2315169167,The State of Design Research,Computer science
https://openalex.org/W2113165395,https://openalex.org/W2315641703,Elicitation Methods in Experimental Design Research,Computer science
https://openalex.org/W2113165395,https://openalex.org/W1968858768,Design Research: A Disciplined Conversation,Computer science
https://openalex.org/W2018754857,https://openalex.org/W2013230108,'TSUNAGARI' communication,Psychology
https://openalex.org/W2018754857,https://openalex.org/W2898062735,The role of vision in face-to-face and mediated communication.,Computer science
https://openalex.org/W2018754857,https://openalex.org/W4251019530,Archives Of General Psychiatry,Psychology
https://openalex.org/W2018754857,https://openalex.org/W2149891956,Tangible bits,Computer science
https://openalex.org/W2346055820,https://openalex.org/W6638365796,,Unknown
https://openalex.org/W2346055820,https://openalex.org/W2153738502,Implementing Service Learning in Higher Education,Business
https://openalex.org/W2346055820,https://openalex.org/W2057132183,Human Dignity and Human Rights: Thoughts on the Principles of Human-Centered Design,Computer science
https://openalex.org/W2346055820,https://openalex.org/W6685000456,,Unknown
https://openalex.org/W2346055820,https://openalex.org/W2121492295,Human-centered Design: Changing Perspectives on Design Education in the East and West,Computer science
https://openalex.org/W2346055820,https://openalex.org/W2072241102,Of What Use is It? Multiple Conceptualizations of Service Learning within Education,Sociology
https://openalex.org/W2346055820,https://openalex.org/W6658054180,,Unknown
https://openalex.org/W2346055820,https://openalex.org/W6619051635,,Unknown
https://openalex.org/W2346055820,https://openalex.org/W6669251087,,Unknown
https://openalex.org/W2346055820,https://openalex.org/W1522231093,Service-Learning: A Balanced Approach to Experiential Education,Computer science
https://openalex.org/W2346055820,https://openalex.org/W1934318481,The Theoretical Roots of Service-Learning in John Dewey: Toward a Theory of Service Learning,Psychology
https://openalex.org/W2346055820,https://openalex.org/W2175238004,Methods in the Making: A Perspective on the State of Human Research in Design,Computer science
https://openalex.org/W2346055820,https://openalex.org/W2170644967,Experiential Learning : Experience as the Source of Learning and Development,Psychology
https://openalex.org/W2346055820,https://openalex.org/W6630395693,,Unknown
https://openalex.org/W2346055820,https://openalex.org/W2096852944,From notions of charity to social justice in service-learning: The complex experience of communities,Sociology
https://openalex.org/W2346055820,https://openalex.org/W4254977989,Reflection in Learning and Professional Development,Psychology
https://openalex.org/W2346055820,https://openalex.org/W2150753832,In pursuit of African scholarship: unpacking engagement,Sociology
https://openalex.org/W2346055820,https://openalex.org/W6665576395,,Unknown
https://openalex.org/W2346055820,https://openalex.org/W6686307444,,Unknown
https://openalex.org/W2346055820,https://openalex.org/W2147264455,Bowling alone: the collapse and revival of American community,Sociology
https://openalex.org/W2021532338,https://openalex.org/W4232425300,Life at Home in the Twenty-First Century,History
https://openalex.org/W2021532338,https://openalex.org/W4230324489,"Ethnomethodology and the Visual: Practices of Looking, Visualization, and Embodied Action",Sociology
https://openalex.org/W2021532338,https://openalex.org/W4301680028,Visual Methods in Social Research,Psychology
https://openalex.org/W2021532338,https://openalex.org/W2479830793,Quantitative Content Analysis of the Visual,Computer science
https://openalex.org/W2021532338,https://openalex.org/W2128500706,The Human–Artifact Model: An Activity Theoretical Approach to Artifact Ecologies,Computer science
https://openalex.org/W2021532338,https://openalex.org/W4288039015,"Photography as Process, Documentary Photographing as Discourse",Art
https://openalex.org/W2021532338,https://openalex.org/W2005459232,Visual ethnography in game design,Computer science
https://openalex.org/W2021532338,https://openalex.org/W2025792249,Imaging the city,Computer science
https://openalex.org/W2021532338,https://openalex.org/W4256740660,Where the Action Is,Sociology
https://openalex.org/W2021532338,https://openalex.org/W2007414186,Colour coding the fridge to reduce food waste,Business
https://openalex.org/W2021532338,https://openalex.org/W2020083551,Research design,Computer science
https://openalex.org/W2021532338,https://openalex.org/W1985010173,Exploring the roles in a photo elicitation dialogue,Computer science
https://openalex.org/W2021532338,https://openalex.org/W1501898063,Distributed cognition in an airline cockpit,Computer science
https://openalex.org/W2021532338,https://openalex.org/W2170174614,Attention to detail,Computer science
https://openalex.org/W2021532338,https://openalex.org/W1480485664,Picturing the Social Landscape,Geography
https://openalex.org/W2021532338,https://openalex.org/W2153222072,Content Analysis: An Introduction to its Methodology.,Computer science
https://openalex.org/W2021532338,https://openalex.org/W2090885571,Working with video: how surgeons produce video records of their actions,Sociology
https://openalex.org/W2021532338,https://openalex.org/W1901523333,The Future of Visual Anthropology,Geography
https://openalex.org/W2021532338,https://openalex.org/W389133725,Doing Visual Ethnography,Sociology
https://openalex.org/W2021532338,https://openalex.org/W4214644097,,Unknown
https://openalex.org/W2940696983,https://openalex.org/W2143360138,Three generations of distance education pedagogy,Sociology
https://openalex.org/W2940696983,https://openalex.org/W2132790752,"Knowledge, Knowledge Work and Organizations: An Overview and Interpretation",Sociology
https://openalex.org/W2940696983,https://openalex.org/W2003388913,"At the end of a huge crit in the summer, it was crap I'd worked really hard but all she said was fine and I was gutted.",Psychology
https://openalex.org/W2940696983,https://openalex.org/W2334995955,Student goes on a journey; stranger rides into the classroom: Narratives and the instructor in the design studio,Psychology
https://openalex.org/W2940696983,https://openalex.org/W2898250508,"Framing learning entanglement in innovative learning spaces: Connecting theory, design and practice",Sociology
https://openalex.org/W2940696983,https://openalex.org/W2170814540,Managing the Complexity of Design Problems through Studio-based Learning,Computer science
https://openalex.org/W2940696983,https://openalex.org/W2039950639,A personal matter? An investigation of students' design process experiences when using a heuristic or a systematic method,Psychology
https://openalex.org/W2940696983,https://openalex.org/W2804281767,Public Art Brings You Home: Using Public Art to Build a Strong Sense of Place,Sociology
https://openalex.org/W2940696983,https://openalex.org/W1965424479,Learning styles of design students and the relationship of academic performance and gender in design education,Psychology
https://openalex.org/W2940696983,https://openalex.org/W1994832990,Design and Studio Pedagogy,Sociology
https://openalex.org/W2940696983,https://openalex.org/W2801427677,Online design education: Searching for a middle ground,Psychology
https://openalex.org/W2940696983,https://openalex.org/W2035986100,The design studio “crit”: Teacher–student communication,Computer science
https://openalex.org/W2940696983,https://openalex.org/W2122285664,"Learning, Teaching, and Scholarship in a Digital Age",Sociology
https://openalex.org/W2940696983,https://openalex.org/W2012359536,Reasserting the Philosophy of Experiential Education as a Vehicle for Change in the 21st Century,Psychology
https://openalex.org/W2940696983,https://openalex.org/W4214642722,,Unknown
https://openalex.org/W2940696983,https://openalex.org/W150850289,Foundations for Design Education: Continuing the Bauhaus<i>Vorkurs</i>Vision,Art
https://openalex.org/W2940696983,https://openalex.org/W1874017009,Investigating the Experiential Impact of Sensory Affect in Contemporary Communication Design Studio Education,Psychology
https://openalex.org/W2940696983,https://openalex.org/W2793835567,Critical perspectives of technology-enhanced learning in relation to specialist Communication Design studio education within the UK and Australia,Sociology
https://openalex.org/W2940696983,https://openalex.org/W1977269671,Self-Authored Graphic Design: A Strategy for Integrative Studies,Psychology
https://openalex.org/W2940696983,https://openalex.org/W2590537396,Feel the Fear: Learning Graphic Design in Affective Places and Online Spaces,Psychology
https://openalex.org/W4322500306,https://openalex.org/W3172712781,Computer-Aided Interaction of Visual Communication Technology and Art in New Media Scenes,Computer science
https://openalex.org/W4322500306,https://openalex.org/W6747402387,,Unknown
https://openalex.org/W4322500306,https://openalex.org/W3130270287,THE USE OF TRIZ (TIPS) METHODS FOR THE PERCEPTION OF THE MODERN VISUAL ART,Computer science
https://openalex.org/W4322500306,https://openalex.org/W3004833263,"A review of design intelligence: progress, problems, and challenges",Computer science
https://openalex.org/W4322500306,https://openalex.org/W3007478210,Artificial intelligence snapchat: Visual conversation agent,Computer science
https://openalex.org/W4322500306,https://openalex.org/W6787709976,,Unknown
https://openalex.org/W4322500306,https://openalex.org/W2992340378,Visual Art And Technology URBAN SCREEN AS A VISUAL ART AND ADVERTISING AREA,Business
https://openalex.org/W4322500306,https://openalex.org/W2954894832,"Civic Media: Technology, Design, Practice",Sociology
https://openalex.org/W4322500306,https://openalex.org/W3040104516,The Graphic Label Was Raised as a Visual Means of Communication to the Values and Behavior of the Individual,Computer science
https://openalex.org/W4322500306,https://openalex.org/W2921968233,Oppositional Designs: Examining How Racial Identity Informs the Critical Design of Art and Space,Sociology
https://openalex.org/W4322500306,https://openalex.org/W3008774220,Automated Colorization of a Grayscale Image With Seed Points Propagation,Computer science
https://openalex.org/W4322500306,https://openalex.org/W2800484229,Australian Communication Design History: An Indigenous Retelling,History
https://openalex.org/W4322500306,https://openalex.org/W6769681128,,Unknown
https://openalex.org/W4322500306,https://openalex.org/W2998702253,Art and messages of visual merchandising,Business
https://openalex.org/W4322500306,https://openalex.org/W2802949094,Design optimisation of a waveguide‐based LP <sub>01</sub> –LP <sub>0m</sub> mode converter by using artificial intelligence technique,Computer science
https://openalex.org/W4322500306,https://openalex.org/W3165887354,[Retracted] Intelligent Environmental Art Design Combining Big Data and Artificial Intelligence,Computer science
https://openalex.org/W4322500306,https://openalex.org/W4293024052,Enabling efficient deep convolutional neural network-based sensor fusion for autonomous driving,Computer science
https://openalex.org/W4322500306,https://openalex.org/W2966350350,Stimulus-driven and concept-driven analysis for image caption generation,Computer science
https://openalex.org/W4322500306,https://openalex.org/W6803251020,,Unknown
https://openalex.org/W4322500306,https://openalex.org/W2624639261,Practice-Led Project as a Creative Method to Enhance Theoretical Knowledge in Art and Design Education,Computer science
https://openalex.org/W4289516714,https://openalex.org/W6773476884,,Unknown
https://openalex.org/W4289516714,https://openalex.org/W6635290054,,Unknown
https://openalex.org/W4289516714,https://openalex.org/W2162870238,Why hasn’t technology disrupted academics’ teaching practices? Understanding resistance to change through the lens of activity theory,Political science
https://openalex.org/W4289516714,https://openalex.org/W3095706026,A state-of-the-art review on mobile robotics tasks using artificial intelligence and visual data,Computer science
https://openalex.org/W4289516714,https://openalex.org/W6790413358,,Unknown
https://openalex.org/W4289516714,https://openalex.org/W2972962400,Convolutive blind source separation in frequency domain with kurtosis maximization by modified conjugate gradient,Mathematics
https://openalex.org/W4289516714,https://openalex.org/W3026150457,Coronavirus (COVID-19) and Online Learning in Higher Institutions of Education: A Survey of the Perceptions of Ghanaian International Students in China,Political science
https://openalex.org/W4289516714,https://openalex.org/W3193626970,Refining the Application of Construal Level Theory: Egocentric and Nonegocentric Psychological Distances in Climate Change Visual Communication,Psychology
https://openalex.org/W4289516714,https://openalex.org/W2512118283,25th Annual Computational Neuroscience Meeting: CNS-2016,Psychology
https://openalex.org/W4289516714,https://openalex.org/W6787705338,,Unknown
https://openalex.org/W4289516714,https://openalex.org/W3159378923,The Conditions for Higher Education Institutions to Meet the Social Challenges Ahead,Political science
https://openalex.org/W4289516714,https://openalex.org/W4200523915,Blockchain as a sustainability-oriented innovation?: Opportunities for and resistance to Blockchain technology as a driver of sustainability in global food supply chains,Business
https://openalex.org/W4289516714,https://openalex.org/W2944189132,Progress in public health risk communication in China: lessons learned from SARS to H7N9,Medicine
https://openalex.org/W4289516714,https://openalex.org/W642474616,Multi-frequency optical unidirectional transmission based on one-way guided mode resonance in an extremely simple dielectric grating,Materials science
https://openalex.org/W4289516714,https://openalex.org/W2773391068,Towards visual strategic communications,Computer science
https://openalex.org/W4289516714,https://openalex.org/W4221074823,Visual Communication Design Using Machine Vision and Digital Media Communication Technology,Computer science
https://openalex.org/W4289516714,https://openalex.org/W4213361019,[Retracted] Visual Communication Design and Wireless Data Transmission Technology for Blockchain Big Data Information Presentation,Computer science
https://openalex.org/W4289516714,https://openalex.org/W2947983652,Machine layout design problem under product family evolution in reconfigurable manufacturing environment: a two-phase-based AMOSA approach,Computer science
https://openalex.org/W4289516714,https://openalex.org/W2995576379,Assessing measurement model quality in PLS-SEM using confirmatory composite analysis,Computer science
https://openalex.org/W4289516714,https://openalex.org/W6786659301,,Unknown
https://openalex.org/W2036050124,https://openalex.org/W2014806649,Communication as Design,Psychology
https://openalex.org/W2036050124,https://openalex.org/W1994578450,"Victims, targets, protectors, and destroyers: Using disputant accounts to develop a grounded taxonomy of disputant orientations",Political science
https://openalex.org/W2036050124,https://openalex.org/W2116137903,What is success in ombuds processes? Evaluation of a university ombudsman,Political science
https://openalex.org/W2036050124,https://openalex.org/W2059394582,My professor is so unfair: Student attitudes and experiences of conflict with faculty,Psychology
https://openalex.org/W2036050124,https://openalex.org/W1138875586,Organ Donation and Transplantation - Public Policy and Clinical Perspectives,Medicine
https://openalex.org/W2036050124,https://openalex.org/W1569374153,Competitive and cooperative conflict communication climates,Psychology
https://openalex.org/W2036050124,https://openalex.org/W2012071200,"The relationship between conflict, anticipatory procedural justice, and design with intentions to use ombudsman processes",Psychology
https://openalex.org/W2036050124,https://openalex.org/W2115370855,Revisiting the Worksite in Worksite Health Campaigns: Evidence From a Multisite Organ Donation Campaign,Sociology
https://openalex.org/W2036050124,https://openalex.org/W4230587655,"Effects of information, education, and communication training about organ donation for gatekeepers: clerks at the Department of Motor Vehicles and organ donor registries",Medicine
https://openalex.org/W2036050124,https://openalex.org/W2094942327,Promoting the Michigan Organ Donor Registry: Evaluating the Impact of a Multifaceted Intervention Utilizing Media Priming and Communication Design,Medicine
https://openalex.org/W2036050124,https://openalex.org/W2161994864,Saving Lives Branch by Branch: The Effectiveness of Driver Licensing Bureau Campaigns to Promote Organ Donor Registry Sign-Ups to African Americans in Michigan,Medicine
https://openalex.org/W2036050124,https://openalex.org/W2060575063,Ombuds processes and disputant reconciliation,Political science
https://openalex.org/W2036050124,https://openalex.org/W1864274370,Disputation by Design,Political science
https://openalex.org/W2036050124,https://openalex.org/W1976288253,The “Tell Us Now” Campaign for Organ Donation: Using Message Immediacy to Increase Donor Registration Rates,Psychology
